smartctl 7.4 2023-08-01 r5530 [x86_64-linux-7.0.0-39-generic] (local build)
Copyright (C) 2002-23, Bruce Allen, Christian Franke, www.smartmontools.org

=== START OF INFORMATION SECTION ===
Model Number:                       EX400U
Serial Number:                      12345NM0038125 H
Firmware Version:                   ULFM91.0
PCI Vendor/Subsystem ID:            0x0000
IEEE OUI Identifier:                0x000000
Controller ID:                      0
NVMe Version:                       1.4
Number of Namespaces:               0
Local Time is:                      Tue Oct  6 19:59:50 2026 EDT
Firmware Updates (0x00):            0 Slots

Supported Power States
St Op     Max   Active     Idle   RL RT WL WT  Ent_Lat  Ex_Lat
 0 +     0.00W       -        -    0  0  0  0        0       0

=== START OF SMART DATA SECTION ===
SMART overall-health self-assessment test result: PASSED

SMART/Health Information (NVMe Log 0x02)
Critical Warning:                   0x00
Temperature:                        32 Celsius
Available Spare:                    100%
Available Spare Threshold:          5%
Percentage Used:                    0%
Data Units Read:                    145,378,127 [74.4 TB]
Data Units Written:                 11,804,314 [6.04 TB]
Host Read Commands:                 0
Host Write Commands:                0
Controller Busy Time:               0
Power Cycles:                       586729545014435522023946085201870961
Power On Hours:                     45645481683379669682411593230173872727
Unsafe Shutdowns:                   539998873287622073367171618238890088
Media and Data Integrity Errors:    0
Error Information Log Entries:      0

Error Information (NVMe Log 0x01, 1 of 1 entries)
No Errors Logged

Self-tests not supported

